Title	Release Year	Genre	Director	Cast	Plot	Origin/Ethnicity
Quarantine	2008	horror	John Erick Dowdle	Jennifer Carpenter, Steve Harris, Jay Hernandez, Columbus Short	"On the evening of March 11, 2008, news reporter and cameraman, Angela Vidal and Scott Percival, are assigned to follow firefighters Jake and Fletcher during their nightshift. They are given a department tour, but an emergency call dispatches them. Arriving, screams from a self-barricaded apartment block room were heard by the landlord and residents. The firemen, police officers, and crew enter; they are attacked by an aggressive elderly woman. Fletcher also mysteriously falls to the base floor, incapacitated. The old woman bites a policeman and is killed. As the residents are ordered downstairs for their own safety, the team finds a second woman in a similar condition and bring her downstairs with others.
Those wounded by the women become sick and delirious. Angela interviews a sick little girl who states that her dog is at the vet because he was sick too. The authorities and CDC suddenly quarantine the building, allowing none to leave. A resident veterinarian recognizes the symptoms as similar to those of rabies. CDC officers wearing hazmat suits enter the building and begin working on the two victims on the ground floor, but chaos ensues as the victims attack. It is revealed that, the day before, the little girl's dog is the reason the CDC has quarantined the building. The little girl bites her mother and later attacks a pursuing police officer. All the other infected break loose and start attacking. The team retreats upstairs and lock themselves in a room, but discover two people who have been bitten. A panicked resident who rips through the window covering is shot by a sniper. The landlord reveals that the basement, which connects to the sewers, may be the only way out. The two infected then attack, forcing Jake, Angela, and Scott to flee the room.
Jake is eventually bitten as the trio find the basement key. Angela and Scott now appear to be the only human survivors. Rather than making their way to the basement, the pair are forced upstairs to the attic apartment by the remaining infected, where they find lab equipment and newspaper clippings about a doomsday cult and a break-in at a chemical weapons lab where a virus was stolen. A trapdoor opens from the attic and Scott loses the camera light as he investigates it, the light broken by a small boy swatting at it. Scott turns on the night vision, and he and Angela hear loud banging noises inside the apartment. The source of the noises is an emaciated man, apparently unaware of them, blindly searching. Scott attempts escape but trips and drops the camera. Angela retrieves it and looks around the room, only to see the man eating Scott. In fright, she cries out and is attacked. She drops the camera and is unable to locate it; as she is crawling in pain, she is then dragged screaming into the darkness."	American
 Scare Campaign	2016	horror	Cameron & Colin Cairns	Meegan Warner, Ian Meadows, Olivia DeJonge	"Scare Campaign is a hidden camera prank show that has been scaring its targets with old school scares for the last 5 years. Their latest target (John Brumpton) nearly ends up shooting an actress thinking she's a real zombie until the crew reveals to him that it's all on TV. Emma (Meegan Warner), another actress on the show, speaks to her director and ex-boyfriend Marcus (Ian Meadows) about being more careful who they prank in case they end up scaring ""the wrong guy"", but Marcus reassures her. Later that morning, their manager, Vicki (Sigrid Thornton) shows them a web series called Masked Freaks that involve a bunch of costumed people killing other people gruesomely. The contents of this web series threatens Scare Campaign's popularity and so Vicki encourages the team to up the ante to increase their ratings.
Hiring a new and young actress named Abby (Olivia DeJonge), Marcus and the team take their next prank to an abandoned psychiatric hospital where they intend to a prank a new groundskeeper, Rohan (Josh Quong Tart). As the prank goes along as planned, Emma starts having second thoughts about it and leaves Rohan alone, where he explores the asylum through many of the team's special effects, despite Emma's pleas to end the prank. When Abby is signalled to surprise him, Rohan stabs her to death with a letter opener, strangles cameraman Tony (Steve Mouzakis) and slits the throat of background actress Suze (Cassandra Magrath). Emma and special effects specialist J.D. (Patrick Harvey) barricade themselves in a room and begs Marcus and camera operator Dick (Jason Geary) to call the police before Rohan breaks in and kills Marcus and Dick, then smiles into the camera. Emma and J.D. make it to the van to escape, but J.D. runs back inside to find the keys. Rohan appears in the van, but Emma stabs his hand with a screwdriver into the car seat and runs inside. It's then revealed that the whole predicament was a prank and Emma was their new stooge. Trent, the actor playing Rohan, berates Marcus and quits.
Suddenly, Masked Freaks appear with weapons equipped to their cameras and kills Trent, revealing themselves as actual serial killers and not actors as the web series made it look. They proceed to murder the other members of Scare Campaign, while Marcus runs back inside after finding Trent dead. He tries to warn Emma, who yells at him and ignores his warning after discovering she was the real stooge of their prank. She finally believes him and they both run inside and find Suze's body and witness Tony getting killed. Masked Freaks hack into Scare Campaign's computer system and reveal they do what they do for the new generation of online entertainment. They then bury Abby alive and give Marcus and Emma five minutes to save her before she runs out of oxygen. Marcus and Emma run out to save Abby and end up killing one of the Masked Freaks, who is revealed to be merely a teenager. After saving Abby, the three are surrounded by the Masked Freaks and their boss tells Emma she may leave with either Marcus or Abby. She chooses Abby and kisses Marcus before leaving with Abby. While they're driving away, the Masked Freaks reveal to Marcus that Abby was their spy the whole time before wheeling Marcus on a stretcher into a furnace. On the drive back to town, Emma notices one of the Masked Freaks cameras in the van pointing at her, leaving her to wonder about Abby's involvement."	Australian
47 Meters Down	2017	horror	Johannes Roberts	Johannes Roberts (director); Johannes Roberts, Ernest Riera (screenplay); Mandy Moore, Claire Holt, Matthew Modine	"Lisa (Mandy Moore) and Kate (Claire Holt) are sisters on holiday in Mexico. Lisa's boyfriend broke up with her because ""she made the relationship boring"". Kate tries to cheer Lisa up and takes her out drinking and dancing at 1:00 am. The sisters meet a pair of local men at a bar and they convince them to go out with them on their boat to watch sharks from a diving cage. Lisa hesitates but Kate persuades her saying it would show Lisa's boyfriend that she isn't boring and make him regret breaking up with her.
The sisters arrive at the boat dock. At first sight, the boat is lackluster and Lisa is immediately wary of it and its owner, Captain Taylor. Upon meeting the girls, the captain asks if the sisters are experienced divers. Kate is a certified diver but Lisa is new to diving, so they lie and say they are both experienced. The dive cage is old and rusty and hangs from a thin chains from an old crane, adding further to Lisa's apprehensions.
As they reach the diving spot, Captain Taylor baits the sharks. Lisa is skeptical about the entire dive, but Captain Taylor dismisses her concerns. The locals dive first in the cage. Unbeknownst to everyone on the boat, the cable supporting the cage starts to fray. The men return to the surface and Captain Taylor prepares to send Lisa and Kate down. When Lisa and Kate are in the cage, the cable breaks and the cage sinks to the bottom, some 47 meters below the surface and out of communication range with the boat. Kate swims up seven meters to resume communications with Captain Taylor, who tells her Javier (Chris J. Johnson) will be coming down with a spare winch to pull them up. He also advises them to stay in the cage as the sharks are circling. Both women are quickly running out of air, but they wait in the cage until they see a torch in the distance. Thinking that Javier cannot see them, Lisa swims out to get him, as Kate's air is lower due to the previous swim. Lisa swims towards the light, close to the bottom to avoid shark attacks from the below. A shark tries to attack Lisa but she swims into a small grotto to avoid it. Continuing to go towards the light, she comes to a crevasse with no bottom in sight.
Swimming over the cliff towards the light she finds the torch but not Javier. While looking around, she gets confused about her distance from the cage and Kate. Just as Javier appears and attempts to usher her back towards safety, he is attacked and killed by a shark. Lisa takes Javier's spear gun and the spare winch, and swims back towards the cage. With the newly acquired torch as well as the spear gun, Lisa swims up and notifies Taylor to pull them up. Disaster strikes as they are being winched to safety: The replacement winch line also snaps and the cage sinks back to the bottom. The cage lands on Lisa's leg, pinning her down. Lisa and Kate panic as they realize they are now both out of options and air.
Kate swims back up to communication range to tell Taylor they are low on air and that Lisa is pinned down. Taylor sends some air tanks down and tells them the Mexican coast guard is an hour out. He also warns her that the second tank may cause nitrogen narcosis which can lead to hallucinations. Kate finds the air tanks just as her original tank runs empty. She also finds three flares to signal the coast guard.
As she returns to the cage, Kate is attacked and dragged away by a shark. Lisa, still pinned and running low on air, uses the spear from the spear gun to pull the tank towards her. In the process, the spear cuts her hand. She dons the new tank, and then hears Kate over the radio. Kate is injured and low on air, and her blood is attracting more sharks. Lisa says she will find her, and uses her BCD to lift up the cage, freeing her leg. After Lisa finds Kate, Taylor tells them the coast guard is still some time out and they need to get back in the cage. Lisa adamantly refuses due to the nature of Kate's wounds, and they decide to swim to the surface. As they swim to the surface, they use one of the three flares to scare the sharks. At the 20-meter mark, they are reminded by Taylor they must wait five minutes to decompress and avoid the bends. As the first flare burns out, Kate tries to light the second flare but drops it and it sinks to the bottom. As she lights the third flare she sees 3 sharks close in front of her. The sisters are now surrounded by sharks and must rush to the surface.
Taylor yells for them to drop their gear and make a break for the surface. They swim as fast as they can towards the surface close to the boat. As they cling to a life ring to get to the boat, one of the sharks bites Lisa's leg and pulls her back down into the water. Lisa hits the shark and gouges its eye out and the shark releases her. Captain Taylor and the other men pull Lisa and Kate onto the boat and begin administering first aid. However, as Lisa stares at her hand on the deck of the boat, she realizes she has been hallucinating due to nitrogen narcosis. She realizes she is still at the bottom with her leg pinned by the cage. She laughs and imagines that she is talking to Kate on the boat deck. The coast guard comes to rescue her and carries Lisa to the surface without Kate. Lisa, as she is slowly and cautiously being brought to the surface, comes out of her hallucination, and realizes her sister is not with her. She starts to cry and call out to Kate, who has been dead since the shark attacked and dragged her away."	American
The Invitation	2016	horror	Karyn Kusama	"Logan Marshall-Green
Tammy Blanchard
Michiel Huisman"	"Will drives with his new girlfriend Kira to the Hollywood Hills home of his ex-wife Eden, who is hosting a dinner party with her new husband David. Will and Eden divorced while trying to cope with their young son Ty's accidental death. Eden met David at a grief support group, and their party will be the first time any of their friends have seen the couple in over two years. On the way, Will strikes and mercy-kills a coyote.
Will and Kira arrive. David and Eden's other dinner guests are Tommy, Tommy's boyfriend Miguel, and friends Ben, Claire, and Gina. Gina mentions that their other friend Choi is running late. Eden introduces Sadie, a girl she and David met while in Mexico who now stays with them.
Throughout the evening, Will wanders in his former home alone and relives memories related to Ty's death, including Eden's attempted suicide. In the kitchen, Will witnesses Eden slap Ben when he makes a joke about her New Age ideas on expelling pain. Eden and David's mysterious friend Pruitt arrives. Will notices that David locked the front door. Will later goes for firewood and spies Eden hide a pill bottle through her bedroom window.
David and Eden tell their guests about a group they joined along with Pruitt and Sadie called ""The Invitation"" to work through grief using spiritual philosophy. David shows everyone a video in which group leader Dr. Joseph comforts a terminally ill woman as she takes her last breaths. David turns away unseen visitors and explains they were strangers looking for a party nearby. The group play a game of ""I Want"" where Sadie kisses Gina, Pruitt confesses to accidentally killing his wife, and Eden kisses Ben. David stops an unsettled Claire from leaving, making Will think David is keeping the guests inside. David changes his mind, and Claire leaves, accompanied by Pruitt, whose car is blocking Claire's. Will watches Pruitt take Claire out of sight to talk to her, and David confronts Will about his suspicion.
During dinner, Will internally reflects on Ty's death. While walking through a hallway, Will sees Sadie make odd faces into a mirror, and they have a strange poolside conversation, during which she sexually propositions him. After rejecting her, Will has a separate discussion with Tommy about the odd atmosphere in the house. Will finally gets a cell phone signal and finds a voice mail from Choi indicating that he was at Eden and David's doorstep before the other guests. Presuming that David and Eden must have done something to Choi, Will publicly confronts the couple about their apparent cult brainwashing. Choi enters unexpectedly, explaining that he was called away by work. Will is embarrassed, but the others assume his residual grief over Ty’s death is causing Will to behave irrationally.
Finding his son's room has been renovated and turned into an office, Will finds a laptop with an ominous video from the founder of The Invitation. David pours drinks for the guests. Will smashes the glasses, fearing they are poisoned. However, Gina drinks hers before Will smashes it. Sadie attacks Will who inadvertently knocks her unconscious in the scuffle. Gina suddenly collapses and dies, revealing that Will was right about the drinks. David, Eden, and Pruitt attack the guests, killing Miguel, Choi, and Ben. Will, Kira, and Tommy flee and hide in the house. Feeling regret over the violence of the killings, Eden is comforted by David, who assures her that what they are doing is the only way they can leave the earth and be freed from their pain. Will retrieves a fireplace poker from Sadie while she lies dying.
Pruitt finds and attacks Will and Kira. Kira retaliates and beats him to death. Eden shoots Will in the shoulder, and herself in the stomach, severely wounding herself. David attacks Tommy, but Tommy stabs David to death. As she dies, Eden asks Will to come to her in her final moments and to take her to the backyard. Kira, Will, and Tommy reunite and head outside with the dying Eden. Tommy goes back inside for Miguel's body. Kira and Will see helicopters flying above. As they watch, Will sees various homes with the same red lantern that David lit earlier in the evening. Will realizes that Los Angeles is erupting in chaos as other cult members throughout the city carry out plans similar to David and Eden's. The two hold hands as the sound of sirens continues."	American
Amazing Adventures of the Living Corpse, TheThe Amazing Adventures of the Living Corpse	2012	horror	Justin Paul Ritter	Michael Villar, Marshall Hilton, Ryan McGivern	As a zombie apocalypse begins, a group of zombies attack the residents in a house. When the family recognizes one of the zombies as a family member, the zombie is shocked back to his senses and decides to protect his family.	American
House of Dust	2013	horror	A.D. Calvo	Inbar Lavi, Steven Grayhm, Eddie Hassell, Holland Roden, John Lee Ames	"1951 - Having already killed OCD patient Billy Brown (Michael Goodin) at the Redding House Asylum, a psychiatrist (Stephen Spinella) experiments on simple-minded inmate Melvin Veman (Peyton Clarkson) and sociopath Levius Laitura (John Lee Ames). With Levius still alive, the psychiatrist has his orderlies put the bodies of all three men inside the crematorium to burn them.
Present Day - Camden College student Dylan (Eddie Hassell) tells his girlfriend Gabby (Holland Roden) and his roommate Kolt (Steven Grayhm) about the now abandoned asylum's haunted history. New student Emma (Inbar Lavi) moves in as Gabby's roommate and Kolt takes a liking to her. However, fellow students Allyson (Alesandra Assante), Christine (Nicole Travolta) and Blythe (Joy Lauren) do not.
Dylan, Kolt, Gabby and Emma break into Redding House after a party to look around despite a warning from campus security guard Clyde (Justin James Lang). Emma has strange experiences while exploring on her own. The other three knock over a container of cremated ashes and inhale the dust of the three men burned there in 1951.
A recovering psychiatric patient herself, Emma begins experiencing haunting visions upon returning to the dorm. The behavior of the other three students gradually changes as Billy possesses Dylan, Melvin inhabits Gabby and Levius takes control of Kolt's body.
Allyson is killed by someone unseen while doing laundry. Christine is later killed while taking her dog outside. Suspecting that the disappearances and the odd behaviors are related to the asylum, Emma tries to go back to Redding House, but Clyde prevents her from going inside.
With Levius in full control of his actions, Kolt attacks Emma. Emma eventually flees into the asylum and confirms her suspicions when she examines patient records and finds the empty urn knocked over by the others. Emma then finds the dead bodies of Allyson, Christine and Blythe (who was killed off screen).
Kolt captures Emma, but Dylan knocks him unconscious (he also knocks Emma unconscious as well) and traps Kolt in the crematorium with Gabby. Emma recovers and frees Kolt and Gabby from the fire, which releases everyone from their possessions. Dylan coughs up Billy's spirit as well. The four students escape Redding House with Clyde's assistance. The crematorium dust goes through the chimney and into the air, ultimately possessing a little boy (Anthony Scarpone-Lambert) playing in the park with the other children nearby."	American
Gekijōban Zero	2014	horror	Mari Asato	Ayami Nakajō, Aoi Morikawa	"Aya, the most popular student of a Catholic all-girls school, suddenly shuts herself in her room. Her admirer, Kasumi Nohara, kisses her photo at midnight and suddenly disappears with her friend Michi as a witness. Her disappearance is quickly attributed to a supposed curse that affects girls who kiss the photo of the person they admire at midnight. Aya's photo is taken to the attic by Sakuya Itsuki and Risa for safekeeping, but the two alongside three other girls are enticed to kiss the photo. Except for Risa, who is later found dazed but alive, all of them are eventually found dead at a nearby river.
When Michi attempts to kiss the photo, Aya stops her and reveals that she is not responsible for the curse, as the photo is not hers. They search help in Kazumi ""Mary"" Kusanagi, an eccentric photographer, who keeps photos inside her studio of lesbian girls who made suicide pact by drowning themselves at a lake, which is now closed down, due to the then society's intolerance towards same-sex couples. She also tells a story about a couple who was doomed when one of them refused to commit suicide, causing her to be haunted by her lover for the rest of her life. Aya then admits to Michi that she is haunted by the guilt of letting a fellow orphan of hers die in front of her.
Michi decides to kiss the photo to put herself into the curse and chains herself to Aya so the latter can save her should she be in danger. However, the two are separated halfway through and Aya is knocked out by Takashi, the mentally handicapped brother of the school nun, Mayumi Aso. She is thrown into a reservoir located at the place where the lesbian couples committed their suicides. There, Aya remembers that the doppelganger is in fact her twin sister, Maya. Though she died at an early age, Maya ""grew up"" alongside Aya and put a curse at the photo until Aya could find her in the reservoir. Meanwhile, Michi is about to be drowned by Mayumi, who is revealed to be the one murdering the girls so as to keep Takashi's supposed involvement in Maya's death a secret, but she chooses to drown herself with Takashi when the authorities are closing in. Michi goes to the reservoir and reunites with Aya.
Aya and Michi participate in the school choir celebrating their graduation. Meanwhile, Mary visits the school's headmistress and abbess, correctly deducing her as the lesbian girl who was haunted by the spirit of her lover. The headmistress reveals that to keep her lover from bothering her, she murdered Maya so the latter could accompany her, though she is distressed when the act led to more murders by Mayumi, although her brother had nothing to do with it. After the choir, Michi bids Aya goodbye before she departs for Tokyo to attend a photography college. She is about to take a photo of her, but pulls up at the last second and makes Aya promise to wait for her until she has become a proper photographer."	Japanese
