Title	Release Year	Genre	Director	Cast	Plot	Origin/Ethnicity
Dark Skies	2013	horror	Scott Stewart	Keri Russell, Josh Hamilton, Dakota Goyo, J. K. Simmons	"The Barrett family—mother Lacy, father Daniel, older son Jesse, and younger son Sammy—reside on a quiet suburban street in an unnamed American city. Daniel is currently unemployed, placing the burden of supporting the family on Lacy, who works as a real estate agent. Their two sons enjoy a happy relationship and communicate with each other from their beds via walkie-talkie.
A number of strange occurrences befall the family. During the night, the contents of the kitchen are rearranged in bizarre configurations. The house alarm is set off when it detects that all entry points were breached simultaneously. Sammy suffers a fit while playing soccer and Lacy is shocked when hundreds of birds suddenly crash into the house. One night, Lacy is awakened by a sound from Sammy's room. When she goes to check on him, through the darkness she sees a figure standing over his bed. She turns on the light to find an empty room. Sammy is found walking away from the house but cannot remember leaving. Lacy, Daniel and Jesse each suffer catatonic episodes and regain consciousness with no memory of their experiences. Strange symbols are found on Jesse and Sammy's bodies.
Greatly disturbed by the various phenomena afflicting the family and the house, Lacy begins to search online for answers and finds articles attributing some of what they have experienced to UFOs and reports of alien abduction. Daniel installs security cameras throughout the house. He reviews the night's footage and frame-by-frame analysis reveals three dark figures standing over their beds as they slept. Now believing that there is an extraterrestrial force at work, Lacy and Daniel seek the help of a specialist, Edwin Pollard, who calls the beings ""the Greys."" Pollard informs them that many others have suffered the same fate as the Barretts, with most cases ending in a child abduction. Edwin warns the Barretts that the person who the Greys first show interest in is usually the one who is abducted and that they should be highly protective of Sammy, who he believes has been ""chosen.""
Daniel buys a shotgun while Lacy buys an aggressive guard dog. The family spend July 4 boarding up the windows of the house, then eat dinner and reminisce about happier times. Suddenly, the house lights begin to flicker and the dog starts barking ferociously. Lacy sends the boys upstairs and stands guard outside the door. Lacy hears the TV in her bedroom turn on. She walks towards it, unaware of a being standing directly behind her, and becomes trapped in her room. Daniel gets Jesse and Sammy into his and Lacy's room where they barricade themselves in and huddle together on the bed. The TV begins to flicker again and the beings – now revealed to be Greys – materialize in the room. Jesse blacks out and experiences a hallucination in which his father commits suicide while standing over his mother's bloodied body. Seeing his brother, Jesse chases after Sammy before reawakening in the upstairs hallway of his house. The Greys appear in front of him and he disappears with them in a flash of light, the rest of the family powerless to help.
Three months later, Lacy and Daniel are suspects in Jesse's disappearance, and have moved into an apartment. Pollard balefully cuts out a newspaper article about Jesse's disappearance and hangs it on his wall with other pictures of missing children. As Lacy is going through old things, she finds pictures that Jesse drew as a child that show the Greys surrounding him. She belatedly realizes that it was Jesse, not Sammy, in whom the Greys first showed interest, and that he was the one who had been chosen. Feedback then emanates from a nearby walkie-talkie as Lacy and Sammy both hear Jesse's faint voice calling Sammy's name."	American
Contracted	2013	horror	Eric England	Najarra Townsend, Alice Macdonald, Katie Stegeman, Caroline Williams	"In a morgue, BJ has sex with a corpse that has a biohazard symbol on the toe tag; afterward, he handles an empty test tube while washing up.
Samantha is trying to get over a recent break-up with her girlfriend, Nikki. The party's host, Alice, plies her with strong drinks, while Zain offers her drugs. After she becomes heavily inebriated, Samantha is approached by BJ, who offers her a drink. Even though she tells him that she is a lesbian, when she begins to black out, BJ takes her to his car and rapes her.
The next morning, Samantha thinks she is suffering from a bad hangover. She bickers with her mother, who struggles to accept her daughter's lesbianism and is worried that she might have relapsed into hard drug use. Alice tells Samantha that the police are searching for BJ, who Alice had never met. At the restaurant where she works, Samantha has trouble eating and is overly sensitive to noise. When she bleeds heavily from her vagina, she visits her doctor. Despite her protests that she is a lesbian who has not had sex with men for nearly a year, he is suspicious that she has contracted a sexually transmitted disease from heterosexual intercourse because of a rash that has developed in her groin.
Samantha tries to repair her relationship with Nikki, who is rude to her. Samantha is hurt to learn that Nikki had not let her know that a scholarship offer had come in the mail. Meanwhile, her symptoms continue to worsen. Her eyes turn bloodshot, her hair falls out in clumps. When she is called into the restaurant on a short-notice shift her fingernails begin to fall off. Samantha flees the restaurant and returns to her doctor, who advises her to avoid contact with other people until tests can determine the nature of her disease. Instead, Samantha visits Zain, who gives her heroin. When Alice arrives, she encourages Samantha to talk to the police about her encounter with BJ. Believing that Alice wants to isolate her from her other friends, Samantha argues with her and storms off. Zain reveals to Alice that he sold Rohypnol to BJ at the party.
Samantha stops off at home and argues violently with her mother. She abruptly leaves for her flower competition but is turned away at the door because of her appearance and the condition of her flowered plant.
Samantha turns to Nikki for consolation, but Nikki coldly rejects her and calls her sexually confused. Enraged, Samantha chokes Nikki to death. She then drives to Alice's in a rage and murders her by biting out her throat. Losing her sanity, Samantha invites Riley, a man who has had a crush on her, to Alice's house and tries to seduce him. Riley sees maggots fall out of Samantha's vagina and becomes repulsed. When he goes to the bathroom to inspect himself, he discovers Alice's body. Samantha flees the house. As she drives, she fades out of consciousness and is involved in a car crash. She emerges from the wreckage transformed fully into a zombie. Her mother, who has arrived at the scene, begs the police not to shoot Samantha. As the police caution Samantha against moving, she lunges at her screaming mother."	American
 Laid to Rest	2009	horror	Robert Green Hall	Bobbi Sue Luther, Kevin Gage, Sean Whalen, Johnathon Schaech, Thomas Dekker, Nick Principe, Richard Lynch, Lena Headey	"A young woman with amnesia breaks out of a coffin in a funeral home, and dials 911 in the morgue, but accidentally unhooks the telephone while speaking to the operator. The mortician appears, and is impaled by a man equipped with a chrome skull mask, and a shoulder mounted camera. The girl stabs ChromeSkull in the eye, and runs off while he treats his wound. The girl is picked up by Tucker, who takes her home to his wife Cindy, and promises her that they will go to the sheriff's station in the morning, as Tucker's truck is low on gas, and their phone service has been cut off.
ChromeSkull tracks the girl (who has been nicknamed ""Princess"") to Tucker's house, and kills Cindy. Tucker and Princess escape in Tucker's truck as ChromeSkull deals with Cindy's brother Johnny and his girlfriend, who had come by to check on Cindy. Tucker and Princess seek aid from a recluse named Steven, who uses his computer to email for help, and research ChromeSkull, discovering he is a serial killer whose modus operandi is to send tapes of himself murdering women to the authorities.
The trio go to the police station, and find the sheriff and a deputy dead, and ChromeSkull waiting for them. The group wound ChromeSkull's leg, and drive away, reaching the funeral home. Princess explores the area, and discovers that a nearby barn contains several of ChromeSkull's previous victims. ChromeSkull beheads a still-living captive, knocks Princess out, and places her in a casket. Before ChromeSkull can kill Princess, he is shot by Tucker, who drives away with her and Steven in ChromeSkull's car.
Princess looks at footage on ChromeSkull's camera, which shows he was in league with the mortician, who he killed due to the man becoming a liability. Princess takes the car while Tucker and Steven are removing bodies from the trunk, and is locked inside by ChromeSkull, who uses his cellphone to take control of the onboard computer as he follows Princess to a convenience store. Via paperwork in the car, Princess finds out ChromeSkull's name is Jesse Cromeans, right before he attacks her.
ChromeSkull prepares to kill Princess, but he is out of tapes for his camera, so he coerces her into going into the store to get one. The clerk sees the threatening messages ChromeSkull is sending Princess through a cellphone, goes out to confront him, and has his head blown off when ChromeSkull turns his own shotgun on him. A customer goes to lock the backdoor, and is decapitated by ChromeSkull. Tucker and Steven reach the store, grab ChromeSkull's suitcase on the way in, and replace the glue he uses to keep his mask on with Cyanoacrylate. ChromeSkull cuts the power, and causes Steven's face to explode by injecting canned tire inflator into his ear. Tucker is stabbed while trying to give Princess enough time to escape with Tommy, the murdered customer's friend.
ChromeSkull locks Tommy out of the building, and traps Princess in a freezer. To taunt Princess, ChromeSkull gives her his camera, which reveals she was a drug addicted prostitute he had picked up, and that she lost her memory when ChromeSkull beat her with a bat. Princess smashes the camera in frustration, and while struggling with ChromeSkull, knocks his mask off. ChromeSkull goes to reaffix his mask, unknowingly using the Cyanoacrylate that Steven had replaced his adhesive with. The chemical melts ChromeSkull's face, and as he writhes in agony, Princess bludgeons him with an aluminum bat.
Princess finds her missing persons notice (which Steven had printed off his computer) in Tucker's pocket, and leaves with Tommy. The police arrive, and find the flyer, which Princess had written an explanation on the back of."	American
It Comes at Night	2017	horror	Trey Edward Shults	Trey Edward Shults (director); Joel Edgerton, Riley Keough, Christopher Abbott, Kelvin Harrison Jr., Carmen Ejogo	"A highly contagious outbreak has ravaged the world. Paul, his wife Sarah, and their teenage son Travis have secluded themselves in their home deep in the woods in an undisclosed location. When Sarah's father, Bud, contracts the disease, they kill him and burn his body in a shallow grave. The next night, they capture an intruder breaking into the house. Paul ties him to a tree and places a bag over his head overnight to confirm he is not suffering from the disease. The stranger, Will, explains that he did not know the house was occupied and was only searching for fresh water for himself, his wife, and his young son. Will offers to trade some of their supply of food for water. Sarah suggests bringing Will's family back to their home, reasoning that the more people they have with them, the easier it would be to defend themselves should anyone else discover their location. Paul agrees, and he takes Will to collect his family. Along the way, they are ambushed by two men. Paul kills them and accuses Will of having set him up. Will points out that he fought them as well and assuages Paul's mistrust.
A few days later, Paul returns along with Will, his wife Kim, and son Andrew. After establishing the rules that Paul and Sarah have used to stay safe, including keeping the only entrance locked with a key Paul or Sarah wear around their neck, and keeping nighttime excursions to a minimum, the two families begin to establish a sense of normality and grow closer to each other. One day, Travis's dog Stanley begins barking aggressively at and chases an unseen presence in the woods. Travis follows the dog deeper into the woods before Stanley's barking suddenly ceases. Travis insists to Paul and Will that he heard something in the woods. They decide to return home, as Paul insists Stanley knows the woods and will find his own way home. That night, Will seemingly contradicts a story he had told Paul earlier about what he and Kim were doing prior to finding the abandoned house. Paul's response suggests an increasing level of distrust of Will.
That evening, Travis is awakened by a nightmare about his grandfather. He discovers Andrew sleeping on the floor of Bud's old room, also suffering from a nightmare. Travis leads him back to his parents' room before hearing a sound from downstairs. Investigating, Travis finds that the front door of the house is slightly opened. He wakes Paul and Will, who investigate further and find a bleeding and gravely sick Stanley lying on the floor. They kill and burn the dog. When Travis reveals that the door was already open when he came downstairs, Sarah suggests that a sleepwalking Andrew might have opened the door. Kim argues the possibility, and as tensions between the two families begin to rise, Paul decides that they should isolate themselves in their own rooms for a couple of days so that they can calm down and ensure no one is infected.
The next morning, Travis overhears a distraught Kim telling Will that they need to leave. Travis informs his parents that Andrew might be infected and, as such, he may be infected himself. Paul and Sarah don protective masks and gloves and take weapons to confront Kim and Will, fearing that they may steal their food and water, or return later by force. When Paul asks to be let in to see if Andrew is sick, Will draws a gun and takes Paul captive. Will insists that his family is healthy and demands Paul give him a fair share of food and water so that they can leave. Paul and Sarah overwhelm Will and force him and his family outside. Will and Paul get into a brutal fight before Sarah shoots Will, who dies from his wound. Kim flees into the woods with Andrew. Paul fires after them, killing Andrew. Kim hysterically begs Paul to kill her to end her misery, and he does. Travis's nose begins bleeding, and he later spots other signs of illness in the mirror.
Later, Travis awakens in bed, visibly sick. His mother comforts him as he dies. Some time later, Paul and Sarah sit at the dinner table in silence. They share a shattered, devastated look as the film ends."	American
Abandoned Mine	2013	horror	Jeff Chamberlain	Alex Vega, Reiley McClendon, Saige Thompson	Five friends explore a supposedly haunted mine to celebrate Halloween, exactly one-hundred years after a family was murdered in the mine. They soon find to their horror that the ghostly rumors may be true as they fight for survival.	American
A Resurrection	2013	horror	Matt Orlando	Devon Sawa, Mischa Barton, Michael Clarke Duncan, Stuart Stone	"Set during a single day and night at a high school, Jessie (Barton), a guidance counselor, Addison (Duncan), the school principal and local police officer, Travis (Sawa) are the central characters of a ""whodunit"" as murder sweeps the school.[6] Jessie attempts to help a mentally disturbed student, Eli who is convinced that his dead brother will return and seek vengeance against the high school students that played a part in his death.[5] His brother was killed after being run-over in a car allegedly driven by the group of high school students. Eli takes his brother's body to a witch who implants a spirit in the corpse. The witch informs Eli that his brother's spirit will rise after six days and will only rest again after committing six murders.[7]"	American
Split	2017	horror	M. Night Shyamalan	M. Night Shyamalan (director/screenplay); James McAvoy, Anya Taylor-Joy, Betty Buckley, Jessica Sula, Haley Lu Richardson, Kim Director, Lyne Renée, Brad William Henke, Neal Huff, Sebastian Arcelus	"Casey Cooke is an emotionally withdrawn teenager, having been molested as a child by her uncle John, who became her legal guardian after her father's death. While hanging out with her classmates, Claire and Marcia, the three are kidnapped by Kevin Wendell Crumb, a man suffering from dissociative identity disorder. Kevin has been evaluated by psychologist Dr. Karen Fletcher, who discovered that he formed multiple personalities as a means to cope with the abuse he suffered at the hands of his mother. While Kevin appears otherwise stable, Dr. Fletcher has identified 23 distinct personalities within Kevin; in his mind, these personalities sit in chairs in a room, waiting for their turn ""in the light"" (controlling Kevin's body) as directed by ""Barry"", the dominant personality. She has also found that Kevin's physiology changes when a new personality comes into the light. Recently, ""Barry"" has refused to allow ""Dennis"" or ""Patricia"" their turns, in part due to Dennis' tendencies towards bothering underage girls and Patricia's undesirable traits, and also because both appear to worship ""The Beast"", a yet-unseen 24th personality. Regardless of which personality is controlling Kevin, Dr. Fletcher can call forth Kevin's own personality by speaking his full name to him.
Kevin takes the girls to his underground quarters and secures them in a cell. They recognize his dissociative disorder, and Claire attempts to use this against Kevin to escape but is caught by ""Dennis"" and segregated from the others. Over several days, Kevin leaves them locked up while he goes off to work and attends appointments with Dr. Fletcher. During these meetings, Dr. Fletcher recognizes that ""Dennis"" has seemingly taken over the dominant personality from ""Barry"", though he tries to act as ""Barry"" to fool her. She recalls an incident that ""Barry"" told her about a month before, where two teenage girls had walked up to him, taken his hands and placed them on their breasts, which may have triggered ""Dennis"" to take over. Dr. Fletcher suspects that Kevin, as ""Dennis"", is responsible for the three missing teenagers.
During this time, Marcia also attempts to escape but is caught by ""Patricia"" and segregated. Casey befriends ""Hedwig"", a young boy personality of Kevin's; it is later revealed that ""Hedwig"" has complete control over ""the light"", and has provided ""Dennis"" and ""Patricia"" with control. She gets ""Hedwig"" to let her out of her cell to see his bedroom, believing that there may be a means of escape through ""Hedwig's"" window but finds that it is only a drawing of a window. She is able to convince ""Hedwig"" to give her a walkie-talkie. She uses it to call for help, but the person at the other end of the walkie doesn't believe her, thinking that someone is playing a joke. Before she can convince the person that she is serious, ""Patricia"" takes over Kevin's body and subdues Casey.
Dr. Fletcher shows up at Kevin's home, where he reveals that ""The Beast"" is real and that he has met him. Suspicious of ""Dennis"", Dr. Fletcher feigns needing the bathroom to look around his home, where she finds Claire in her cell, but before she can do anything, ""Dennis"" catches her, sprays her face with a sedative in an aerosol can, and secures her in a separate room. He then leaves. While out, ""The Beast"" personality takes over for the first time, giving Kevin super-human abilities, while Claire and Marcia attempt to escape from their cells. Dr. Fletcher regains consciousness long enough to write out Kevin's full name on a piece of paper before ""The Beast"" returns and kills her. Casey escapes from her cell, only to find that ""The Beast"" has already attacked and eaten Marcia and watches in horror as he does the same to Claire.
Casey finds Dr. Fletcher's body and her note on the piece of paper. ""The Beast"" approaches her, but she calls out Kevin's full name, bringing Kevin forth. Upon learning of the situation and realizing that he hasn't been in control of his body for two years, Kevin instructs Casey to kill him with his shotgun. Following this statement, all 24 personalities begin warring for control of ""the light"", but shortly thereafter ""The Beast"" personality takes hold again. Casey escapes from his quarters into an underground tunnel and shoots him twice, but the shells have little effect. She locks herself in a small caged area. ""The Beast"" finds her and is about to pull the bars open to attack her but sees faded scars across her body, a sign of her past emotional turmoil and self-harm. Having previously declared his plans to rid the world of the ""untouched"", those whose hearts are impure because they have never suffered in their lives, he considers Casey to be ""pure"" and spares her, disappearing from the tunnels.
Sometime later, Casey is rescued and learns that she was being held at the Philadelphia Zoo, where Kevin had been an employee. Casey is asked by a police officer if she is ready to return home with her uncle. She hesitates to answer. In another hideout, ""Dennis"", ""Patricia"", and ""Hedwig"" exert collective control over Kevin's body and admire the power of ""The Beast"" and their plans to change the world.
In a diner, several patrons watch the news as a reporter states that Kevin's personalities have earned him the nickname ""The Horde"". A female patron notes the similarity between Kevin and a wheelchair-using criminal who was incarcerated 15 years earlier. As she tries to remember the nickname he was given, the man sitting next to her tells her that it was ""Mr. Glass""."	American
